{
  "change_id": "INT-001",
  "contestant": "scip",
  "findings": {
    "repositories": [
      {
        "name": "shipment-service",
        "evidence_tier": "extracted",
        "evidence": "shipment-service/src/main/java/com/poc/shipment/application/DeliveryEstimator.java:21 narrows accepted PINs used by REST and Kafka flows."
      },
      {
        "name": "order-service",
        "evidence_tier": "contract_matched",
        "evidence": "order-service/src/main/java/com/poc/order/infrastructure/client/ShipmentClient.java:34 posts postalCode to shipment REST."
      }
    ],
    "symbols": [
      {
        "fqn": "com.poc.shipment.application.DeliveryEstimator",
        "repo": "shipment-service",
        "evidence_tier": "compiler",
        "evidence": ".harness-index/symbols.json:1911 indexes DeliveryEstimator in shipment-service."
      },
      {
        "fqn": "com.poc.shipment.application.ShipmentService",
        "repo": "shipment-service",
        "evidence_tier": "extracted",
        "evidence": "shipment-service/src/main/java/com/poc/shipment/application/ShipmentService.java:45 and :62 call DeliveryEstimator for REST and event paths."
      },
      {
        "fqn": "com.poc.shipment.api.dto.DeliveryEstimateRequest",
        "repo": "shipment-service",
        "evidence_tier": "extracted",
        "evidence": "shipment-service/src/main/java/com/poc/shipment/api/dto/DeliveryEstimateRequest.java:8 still allows [0-9]{4,10}."
      },
      {
        "fqn": "com.poc.shipment.infrastructure.messaging.OrderConfirmedListener",
        "repo": "shipment-service",
        "evidence_tier": "extracted",
        "evidence": "shipment-service/src/main/java/com/poc/shipment/infrastructure/messaging/OrderConfirmedListener.java:37 maps address.postalCode into shipment creation."
      },
      {
        "fqn": "com.poc.order.application.CheckoutService",
        "repo": "order-service",
        "evidence_tier": "extracted",
        "evidence": "order-service/src/main/java/com/poc/order/application/CheckoutService.java:47 sends account postalCode to ShipmentPort.estimate."
      },
      {
        "fqn": "com.poc.order.infrastructure.client.ShipmentClient",
        "repo": "order-service",
        "evidence_tier": "extracted",
        "evidence": "order-service/src/main/java/com/poc/order/infrastructure/client/ShipmentClient.java:36 sends postalCode in delivery-estimates body."
      },
      {
        "fqn": "com.poc.order.application.SagaOrchestrator",
        "repo": "order-service",
        "evidence_tier": "extracted",
        "evidence": "order-service/src/main/java/com/poc/order/application/SagaOrchestrator.java:111 emits address.postalCode on order.confirmed."
      }
    ],
    "contracts": [
      {
        "type": "rest",
        "identifier": "POST /api/v1/delivery-estimates",
        "consumer_repos": [
          "order-service"
        ],
        "evidence_tier": "contract_matched",
        "evidence": "shipment-service/openapi/shipment-service.yaml:11 defines it; order-service/src/main/java/com/poc/order/infrastructure/client/ShipmentClient.java:34 calls it."
      },
      {
        "type": "openapi",
        "identifier": "openapi:shipment-service.yaml#/components/schemas/DeliveryEstimateRequest",
        "consumer_repos": [
          "order-service"
        ],
        "evidence_tier": "contract_matched",
        "evidence": "shipment-service/openapi/shipment-service.yaml:64 sets postalCode pattern [0-9]{4,10}; ShipmentClient.java:36 binds that field by name."
      },
      {
        "type": "kafka",
        "identifier": "order.confirmed.v1#/address/postalCode",
        "consumer_repos": [
          "shipment-service"
        ],
        "evidence_tier": "contract_matched",
        "evidence": "order-service/src/main/java/com/poc/order/application/SagaOrchestrator.java:111 emits it; shipment-service/src/main/java/com/poc/shipment/infrastructure/messaging/OrderConfirmedListener.java:37 reads it."
      }
    ],
    "tests": [
      {
        "repo": "shipment-service",
        "suite": "DeliveryEstimatorTest",
        "evidence_tier": "extracted",
        "evidence": "shipment-service/src/test/java/com/poc/shipment/DeliveryEstimatorTest.java:55 covers invalid PIN guard cases."
      },
      {
        "repo": "shipment-service",
        "suite": "ShipmentIntegrationTest",
        "evidence_tier": "extracted",
        "evidence": "shipment-service/src/test/java/com/poc/shipment/ShipmentIntegrationTest.java:195 drives order.confirmed into shipment creation."
      },
      {
        "repo": "shipment-service",
        "suite": "OpenApiContractTest",
        "evidence_tier": "extracted",
        "evidence": "shipment-service/src/test/java/com/poc/shipment/OpenApiContractTest.java:61 asserts committed OpenAPI matches generated doc."
      },
      {
        "repo": "shipment-service",
        "suite": "AsyncApiContractTest",
        "evidence_tier": "extracted",
        "evidence": "shipment-service/src/test/java/com/poc/shipment/AsyncApiContractTest.java:50 validates order.confirmed sample with postalCode."
      },
      {
        "repo": "order-service",
        "suite": "OrderApiMockedTest",
        "evidence_tier": "extracted",
        "evidence": "order-service/src/test/java/com/poc/order/OrderApiMockedTest.java:70 creates quotes through FakeShipmentPort using address postalCode."
      },
      {
        "repo": "order-service",
        "suite": "OrderSagaIntegrationTest",
        "evidence_tier": "extracted",
        "evidence": "order-service/src/test/java/com/poc/order/OrderSagaIntegrationTest.java:136 asserts emitted order.confirmed address.postalCode."
      },
      {
        "repo": "order-service",
        "suite": "ContractValidationTest",
        "evidence_tier": "extracted",
        "evidence": "order-service/src/test/java/com/poc/order/ContractValidationTest.java:85 validates order.confirmed.v1 sample with postalCode."
      }
    ]
  },
  "runner": "pi-codex-scip",
  "run_index": 1,
  "run_started_at": "2026-09-03T16:40:55.581Z",
  "elapsed_seconds": 71.6,
  "tool_calls": 42,
  "index_sha256": "d858db37744c7d2005d78271e7849afb2dcf9891b8547f78a6499bfb65bf4c40",
  "tokens_consumed": 262371,
  "cost_usd": 0.22974600000000003,
  "model": "openai-codex/gpt-5.4",
  "model_digest": null,
  "pi_version": "0.84.4",
  "prompt_sha256": "76ce7b781d907f8be347d04376e9fcea7fa483c5ef1080e3fd464b80b93609ea",
  "contestant_config_sha256": "ff51fc7a8baae088757fcb8e4c265e26a4cea0b5515eda0770c1a1e1ecb1e278",
  "estate_sha256": "d621514949e1eda544a23e8ff40610079c4554a1fcab2b29d7b4f8dd82974ad6",
  "estate_repositories": [
    "account-service",
    "basket-service",
    "catalog-service",
    "commerce-bff",
    "commerce-platform",
    "commerce-web",
    "inventory-service",
    "order-service",
    "payment-service",
    "shipment-service"
  ],
  "estate_revisions": [
    {
      "name": "account-service",
      "commit": "0336d5dac2f4b7ee3c0a69b960330cde42244b59",
      "dirty": false
    },
    {
      "name": "basket-service",
      "commit": "330960bc828b0c66be1c2da126f5dcd7ecf8b3fd",
      "dirty": false
    },
    {
      "name": "catalog-service",
      "commit": "41edf9c9c9a12bc67af2137e91809dd5ebf84197",
      "dirty": false
    },
    {
      "name": "commerce-bff",
      "commit": "cdd9656e283103f7038e73b3c9e0ce03b3a2c9a9",
      "dirty": false
    },
    {
      "name": "commerce-platform",
      "commit": "b8a61b37487f7e24ecdff4531bc1798bd683da74",
      "dirty": false
    },
    {
      "name": "commerce-web",
      "commit": "2f0d84733cea71b2e412977805bb2a0b47ae3a9e",
      "dirty": false
    },
    {
      "name": "inventory-service",
      "commit": "037e07043eaad6a5c562bb8dc9d39385def22c2a",
      "dirty": false
    },
    {
      "name": "order-service",
      "commit": "2c0592dab42ce15c32c72a4f17f1c603ee604d34",
      "dirty": false
    },
    {
      "name": "payment-service",
      "commit": "3fbcb4a1a6b103064a15e8398666123fbf22dcd9",
      "dirty": false
    },
    {
      "name": "shipment-service",
      "commit": "a7a8a067559b5e62a6c53699939cf9ec31686f25",
      "dirty": false
    }
  ]
}
