{
 "findings": {
  "repositories": [
   {
    "name": "account-service",
    "evidence_tier": "extracted",
    "evidence": "account-service/src/main/java/com/poc/account/api/dto/AddressResponse.java:13 declares the outbound postalCode JSON component."
   },
   {
    "name": "commerce-web",
    "evidence_tier": "extracted",
    "evidence": "commerce-web/src/pages/CheckoutPage.tsx:112 reads address.postalCode from address API responses."
   },
   {
    "name": "order-service",
    "evidence_tier": "extracted",
    "evidence": "order-service/src/main/java/com/poc/order/infrastructure/client/AccountClient.java:41 assigns response.postalCode() into an AddressSnapshot."
   },
   {
    "name": "shipment-service",
    "evidence_tier": "extracted",
    "evidence": "shipment-service/src/main/java/com/poc/shipment/infrastructure/messaging/OrderConfirmedListener.java:37 requires the preserved order.confirmed postalCode key."
   }
  ],
  "symbols": [
   {
    "fqn": "com.poc.account.api.dto.AddressResponse",
    "repo": "account-service",
    "evidence_tier": "extracted",
    "evidence": "account-service/src/main/java/com/poc/account/api/dto/AddressResponse.java:13 declares postalCode as the API response component."
   },
   {
    "fqn": "Address",
    "repo": "commerce-web",
    "evidence_tier": "extracted",
    "evidence": "commerce-web/src/api/types.ts:54 declares the response carrier's postalCode property."
   },
   {
    "fqn": "com.poc.order.domain.model.AddressSnapshot",
    "repo": "order-service",
    "evidence_tier": "extracted",
    "evidence": "order-service/src/main/java/com/poc/order/infrastructure/client/AccountClient.java:40-41 constructs this snapshot from the name-bound account response field."
   }
  ],
  "contracts": [
   {
    "type": "rest",
    "identifier": "POST /api/v1/addresses",
    "consumer_repos": [
     "commerce-web",
     "order-service"
    ],
    "evidence_tier": "contract_matched",
    "evidence": "account-service/openapi/account.yaml:246 defines the response postalCode property, consumed by commerce-web/src/api/types.ts:54 and order-service/src/main/java/com/poc/order/infrastructure/client/AccountClient.java:24."
   },
   {
    "type": "openapi",
    "identifier": "openapi:account.yaml#/components/schemas/AddressResponse",
    "consumer_repos": [
     "order-service"
    ],
    "evidence_tier": "contract_matched",
    "evidence": "account-service/openapi/account.yaml:225 defines AddressResponse and order-service/src/main/java/com/poc/order/infrastructure/client/AccountClient.java:24 binds that response by field name."
   },
   {
    "type": "rest",
    "identifier": "POST /api/v1/delivery-estimates",
    "consumer_repos": [
     "order-service"
    ],
    "evidence_tier": "contract_matched",
    "evidence": "order-service/src/main/java/com/poc/order/infrastructure/client/ShipmentClient.java:36 emits postalCode, matching shipment-service/src/main/java/com/poc/shipment/api/dto/DeliveryEstimateRequest.java:8; this key must remain unchanged."
   },
   {
    "type": "kafka",
    "identifier": "order.confirmed.v1#/address/postalCode",
    "consumer_repos": [
     "shipment-service"
    ],
    "evidence_tier": "contract_matched",
    "evidence": "order-service/src/main/java/com/poc/order/application/SagaOrchestrator.java:111 emits postalCode and shipment-service/src/main/java/com/poc/shipment/infrastructure/messaging/OrderConfirmedListener.java:37 consumes it; this key must remain unchanged."
   }
  ],
  "tests": [
   {
    "repo": "account-service",
    "suite": "AccountFlowComponentTest",
    "evidence_tier": "extracted",
    "evidence": "account-service/src/test/java/com/poc/account/AccountFlowComponentTest.java:128 asserts the address response's $.postalCode field."
   },
   {
    "repo": "order-service",
    "suite": "OrderSagaIntegrationTest",
    "evidence_tier": "extracted",
    "evidence": "order-service/src/test/java/com/poc/order/OrderSagaIntegrationTest.java:136 asserts order.confirmed.address.postalCode."
   },
   {
    "repo": "shipment-service",
    "suite": "AsyncApiContractTest",
    "evidence_tier": "extracted",
    "evidence": "shipment-service/src/test/java/com/poc/shipment/AsyncApiContractTest.java:55 validates a frozen order.confirmed sample containing address.postalCode."
   }
  ]
 },
 "change_id": "REST-001",
 "contestant": "codex-direct",
 "runner": "codex-direct",
 "tokens_consumed": 50252
}