{
 "findings": {
  "repositories": [
   {
    "name": "account-service",
    "evidence_tier": "extracted",
    "evidence": "account-service/openapi/account.yaml:217 documents postalCode in the address request schema."
   },
   {
    "name": "commerce-web",
    "evidence_tier": "extracted",
    "evidence": "commerce-web/src/pages/CheckoutPage.tsx:119 posts addressInput.postalCode."
   },
   {
    "name": "commerce-platform",
    "evidence_tier": "extracted",
    "evidence": "commerce-platform/e2e-bruno/01-signup-to-confirmed-order/04-create-address.bru:23 posts postalCode."
   },
   {
    "name": "order-service",
    "evidence_tier": "contract_matched",
    "evidence": "order-service/src/main/java/com/poc/order/infrastructure/client/AccountClient.java:41 maps Account's response.postalCode() into an address snapshot."
   },
   {
    "name": "shipment-service",
    "evidence_tier": "contract_matched",
    "evidence": "shipment-service/asyncapi/schemas/order.confirmed.v1.json:19 requires the downstream event key postalCode."
   }
  ],
  "symbols": [
   {
    "fqn": "Address",
    "repo": "commerce-web",
    "evidence_tier": "extracted",
    "evidence": "commerce-web/src/api/types.ts:54 declares postalCode on the browser address model."
   },
   {
    "fqn": "com.poc.order.domain.model.AddressSnapshot",
    "repo": "order-service",
    "evidence_tier": "contract_matched",
    "evidence": "order-service/src/main/java/com/poc/order/infrastructure/client/AccountClient.java:41 assigns response.postalCode() into AddressSnapshot."
   },
   {
    "fqn": "com.poc.shipment.domain.model.DeliveryAddress",
    "repo": "shipment-service",
    "evidence_tier": "inferred",
    "evidence": "shipment-service/src/main/java/com/poc/shipment/infrastructure/messaging/OrderConfirmedListener.java:37 assigns the event's postalCode into DeliveryAddress, so a propagated null reaches delivery estimation."
   }
  ],
  "contracts": [
   {
    "type": "rest",
    "identifier": "POST /api/v1/addresses",
    "consumer_repos": [
     "commerce-web",
     "commerce-platform",
     "order-service"
    ],
    "evidence_tier": "contract_matched",
    "evidence": "account-service/openapi/account.yaml:30 exposes AddressRequest on the resource, while commerce-web/src/api/checkout.ts:7 posts it and AccountClient.java:33 reads its address resource."
   },
   {
    "type": "openapi",
    "identifier": "openapi:account.yaml#/components/schemas/AddressRequest",
    "consumer_repos": [
     "commerce-web"
    ],
    "evidence_tier": "contract_matched",
    "evidence": "account-service/openapi/account.yaml:217 defines postalCode and commerce-web/src/pages/CheckoutPage.tsx:119 binds and submits that property."
   },
   {
    "type": "openapi",
    "identifier": "openapi:account.yaml#/components/schemas/AddressResponse",
    "consumer_repos": [
     "commerce-web",
     "order-service"
    ],
    "evidence_tier": "contract_matched",
    "evidence": "account-service/openapi/account.yaml:246 defines postalCode and order-service/src/main/java/com/poc/order/infrastructure/client/AccountClient.java:25 binds it."
   },
   {
    "type": "kafka",
    "identifier": "order.confirmed.v1#/address/postalCode",
    "consumer_repos": [
     "shipment-service"
    ],
    "evidence_tier": "contract_matched",
    "evidence": "order-service/src/main/java/com/poc/order/application/SagaOrchestrator.java:111 emits postalCode and shipment-service/src/main/java/com/poc/shipment/infrastructure/messaging/OrderConfirmedListener.java:37 consumes it."
   }
  ],
  "tests": [
   {
    "repo": "account-service",
    "suite": "AccountFlowComponentTest",
    "evidence_tier": "extracted",
    "evidence": "account-service/src/test/java/com/poc/account/AccountFlowComponentTest.java:128 asserts the address response's postalCode."
   },
   {
    "repo": "order-service",
    "suite": "OrderSagaIntegrationTest",
    "evidence_tier": "extracted",
    "evidence": "order-service/src/test/java/com/poc/order/OrderSagaIntegrationTest.java:136 asserts postalCode remains in order.confirmed.v1."
   },
   {
    "repo": "shipment-service",
    "suite": "ShipmentIntegrationTest",
    "evidence_tier": "extracted",
    "evidence": "shipment-service/src/test/java/com/poc/shipment/ShipmentIntegrationTest.java:171 builds the consumed order.confirmed.v1 address with postalCode."
   },
   {
    "repo": "commerce-platform",
    "suite": "e2e-bruno/01-signup-to-confirmed-order",
    "evidence_tier": "extracted",
    "evidence": "commerce-platform/e2e-bruno/01-signup-to-confirmed-order/04-create-address.bru:23 posts postalCode."
   },
   {
    "repo": "commerce-platform",
    "suite": "e2e-bruno/05-basket-changed-after-quote",
    "evidence_tier": "extracted",
    "evidence": "commerce-platform/e2e-bruno/05-basket-changed-after-quote/04-create-address.bru:23 posts postalCode."
   },
   {
    "repo": "commerce-platform",
    "suite": "e2e-bruno/06-out-of-stock",
    "evidence_tier": "extracted",
    "evidence": "commerce-platform/e2e-bruno/06-out-of-stock/03-create-address.bru:23 posts postalCode."
   },
   {
    "repo": "commerce-platform",
    "suite": "e2e-bruno/07-payment-decline",
    "evidence_tier": "extracted",
    "evidence": "commerce-platform/e2e-bruno/07-payment-decline/03-create-address.bru:23 posts postalCode."
   },
   {
    "repo": "commerce-platform",
    "suite": "e2e-bruno/08-duplicate-place-order",
    "evidence_tier": "extracted",
    "evidence": "commerce-platform/e2e-bruno/08-duplicate-place-order/03-create-address.bru:23 posts postalCode."
   }
  ]
 },
 "change_id": "REST-001",
 "contestant": "codex-direct",
 "runner": "codex-direct",
 "tokens_consumed": 76922
}