{
  "change_id": "REST-004",
  "contestant": "gortex",
  "findings": {
    "repositories": [
      {
        "name": "basket-service",
        "evidence_tier": "extracted",
        "evidence": "basket-service/src/main/java/com/poc/basket/domain/model/Coupon.java:3 defines discountPercent on Coupon."
      },
      {
        "name": "order-service",
        "evidence_tier": "contract_matched",
        "evidence": "order-service/src/main/java/com/poc/order/infrastructure/client/BasketClient.java:25 binds BasketResponse from basket-service /api/v1/basket."
      },
      {
        "name": "commerce-bff",
        "evidence_tier": "contract_matched",
        "evidence": "commerce-bff/src/main/java/com/poc/bff/api/BasketProxyController.java:73 relays /api/v1/basket/coupon and /api/v1/basket unchanged as JsonNode."
      },
      {
        "name": "commerce-web",
        "evidence_tier": "contract_matched",
        "evidence": "commerce-web/src/api/types.ts:36 defines Basket with discountMinor from the basket REST response."
      }
    ],
    "symbols": [
      {
        "fqn": "com.poc.basket.domain.model.Coupon",
        "repo": "basket-service",
        "evidence_tier": "extracted",
        "evidence": "basket-service/src/main/java/com/poc/basket/domain/model/Coupon.java:3 declares Coupon(String code, int discountPercent, boolean active)."
      },
      {
        "fqn": "com.poc.basket.application.BasketPricing",
        "repo": "basket-service",
        "evidence_tier": "extracted",
        "evidence": "basket-service/src/main/java/com/poc/basket/application/BasketPricing.java:35 computes discount from coupon.discountPercent()."
      },
      {
        "fqn": "com.poc.basket.infrastructure.persistence.row.CouponRow",
        "repo": "basket-service",
        "evidence_tier": "extracted",
        "evidence": "basket-service/src/main/java/com/poc/basket/infrastructure/persistence/row/CouponRow.java:3 declares discountPercent column mapping."
      },
      {
        "fqn": "com.poc.basket.infrastructure.persistence.repository.MyBatisBasketRepository",
        "repo": "basket-service",
        "evidence_tier": "extracted",
        "evidence": "basket-service/src/main/java/com/poc/basket/infrastructure/persistence/repository/MyBatisBasketRepository.java:95 maps row.discountPercent() into Coupon."
      },
      {
        "fqn": "com.poc.order.infrastructure.client.BasketClient",
        "repo": "order-service",
        "evidence_tier": "extracted",
        "evidence": "order-service/src/main/java/com/poc/order/infrastructure/client/BasketClient.java:25 binds basket-service BasketResponse for quote creation."
      },
      {
        "fqn": "com.poc.bff.api.BasketProxyController",
        "repo": "commerce-bff",
        "evidence_tier": "extracted",
        "evidence": "commerce-bff/src/main/java/com/poc/bff/api/BasketProxyController.java:73 relays coupon requests and basket responses as JsonNode."
      }
    ],
    "contracts": [
      {
        "type": "openapi",
        "identifier": "openapi:basket.yaml#/components/schemas/BasketResponse",
        "consumer_repos": [
          "order-service",
          "commerce-bff",
          "commerce-web"
        ],
        "evidence_tier": "contract_matched",
        "evidence": "basket-service/openapi/basket.yaml:205 defines BasketResponse with discountMinor used by BasketClient and BFF relay."
      },
      {
        "type": "rest",
        "identifier": "GET /api/v1/basket",
        "consumer_repos": [
          "order-service",
          "commerce-bff",
          "commerce-web"
        ],
        "evidence_tier": "contract_matched",
        "evidence": "order-service/src/main/java/com/poc/order/infrastructure/client/BasketClient.java:33 calls /api/v1/basket and reads discountMinor."
      },
      {
        "type": "rest",
        "identifier": "PUT /api/v1/basket/coupon",
        "consumer_repos": [
          "commerce-bff",
          "commerce-web"
        ],
        "evidence_tier": "contract_matched",
        "evidence": "commerce-web/src/api/basket.ts:27 calls /basket/coupon via BFF to get updated Basket payload."
      }
    ],
    "tests": [
      {
        "repo": "basket-service",
        "suite": "BasketApiMockedTest",
        "evidence_tier": "extracted",
        "evidence": "basket-service/src/test/java/com/poc/basket/BasketApiMockedTest.java:181 seeds Coupon(\"SAVE10\", 10, true)."
      },
      {
        "repo": "basket-service",
        "suite": "BasketRepositoryComponentTest",
        "evidence_tier": "extracted",
        "evidence": "basket-service/src/test/java/com/poc/basket/BasketRepositoryComponentTest.java:130 asserts coupon.discountPercent()."
      },
      {
        "repo": "commerce-bff",
        "suite": "BffIntegrationTest",
        "evidence_tier": "extracted",
        "evidence": "commerce-bff/src/test/java/com/poc/bff/BffIntegrationTest.java:169 relays PUT /api/v1/basket/coupon body unchanged."
      },
      {
        "repo": "commerce-web",
        "suite": "app.test.tsx",
        "evidence_tier": "extracted",
        "evidence": "commerce-web/src/test/app.test.tsx:21 builds Basket fixtures with discountMinor consumed by basket UI."
      },
      {
        "repo": "order-service",
        "suite": "OrderApiMockedTest",
        "evidence_tier": "extracted",
        "evidence": "order-service/src/test/java/com/poc/order/OrderApiMockedTest.java:100 asserts quote price.discountMinor from basket snapshot."
      }
    ]
  },
  "runner": "pi-codex-gortex",
  "run_index": 1,
  "run_started_at": "2026-09-03T17:19:29.108Z",
  "elapsed_seconds": 66.7,
  "tool_calls": 36,
  "index_sha256": "206d524ec46312b3ce3607a8357aff617912ade4c1a7c2813bcea02506570cf6",
  "tokens_consumed": 321924,
  "cost_usd": 0.217517,
  "model": "openai-codex/gpt-5.4",
  "model_digest": null,
  "pi_version": "0.84.4",
  "prompt_sha256": "e6df90ed43dbace409cc8d044b337fb8108a828cf82c0a2609629527a985c08d",
  "contestant_config_sha256": "6346c31d0e47e7ab45945e9d13eb1974e4e3b4bf29b46c7850a69a6585f6d7c8",
  "estate_sha256": "d621514949e1eda544a23e8ff40610079c4554a1fcab2b29d7b4f8dd82974ad6",
  "estate_repositories": [
    "account-service",
    "basket-service",
    "catalog-service",
    "commerce-bff",
    "commerce-platform",
    "commerce-web",
    "inventory-service",
    "order-service",
    "payment-service",
    "shipment-service"
  ],
  "estate_revisions": [
    {
      "name": "account-service",
      "commit": "0336d5dac2f4b7ee3c0a69b960330cde42244b59",
      "dirty": false
    },
    {
      "name": "basket-service",
      "commit": "330960bc828b0c66be1c2da126f5dcd7ecf8b3fd",
      "dirty": false
    },
    {
      "name": "catalog-service",
      "commit": "41edf9c9c9a12bc67af2137e91809dd5ebf84197",
      "dirty": false
    },
    {
      "name": "commerce-bff",
      "commit": "cdd9656e283103f7038e73b3c9e0ce03b3a2c9a9",
      "dirty": false
    },
    {
      "name": "commerce-platform",
      "commit": "b8a61b37487f7e24ecdff4531bc1798bd683da74",
      "dirty": false
    },
    {
      "name": "commerce-web",
      "commit": "2f0d84733cea71b2e412977805bb2a0b47ae3a9e",
      "dirty": false
    },
    {
      "name": "inventory-service",
      "commit": "037e07043eaad6a5c562bb8dc9d39385def22c2a",
      "dirty": false
    },
    {
      "name": "order-service",
      "commit": "2c0592dab42ce15c32c72a4f17f1c603ee604d34",
      "dirty": false
    },
    {
      "name": "payment-service",
      "commit": "3fbcb4a1a6b103064a15e8398666123fbf22dcd9",
      "dirty": false
    },
    {
      "name": "shipment-service",
      "commit": "a7a8a067559b5e62a6c53699939cf9ec31686f25",
      "dirty": false
    }
  ]
}
